{
  "id": "award",
  "kind": "component",
  "label": "Award",
  "summary": "A trophy-shelf block: one award image and the caption telling who gave it and when.",
  "era": "\"This site won the Golden Floppy, March 1999\", awards traded between webmasters like merit badges.",
  "since": "0.1.0",
  "stability": "stable",
  "requiresJs": false,
  "jsEnhancer": null,
  "classes": [
    { "name": "rs-award", "role": "trophy-shelf block for one award image" },
    { "name": "rs-award__caption", "role": "the who/what/when line" }
  ],
  "a11y": "A <figure> with <figcaption>: the alt names the award, the caption tells the story.",
  "assets": [],
  "tags": ["content", "award", "image"]
}
